{
  "schema": "universal_root_gate_spec_v1",
  "version": "1.1.0",
  "generated_at_utc": "2026-06-22T09:55:01Z",
  "research_only": true,
  "send_gate": "HOLD",
  "hypothesis_class": "HYPO",
  "track_a_promotion_forbidden": true,
  "lit_review_pointer": "docs/research/UNIVERSAL_ROOT_LEXICON_MATRIX_LIT_REVIEW_2026-06-21.md",
  "architecture": {
    "summary_ko": "41k corpus anchor를 NSM 65 prime으로 대체하지 않는다. Layer A는 shallow 게이트·도메인 태그·NSM prime 라벨(≤3)만, Layer B는 41k+sidecar 검색·압축, Layer C는 MDL surface prune만 담당한다.",
    "layer_flow": [
      "layer_a",
      "layer_b",
      "layer_c"
    ]
  },
  "layers": {
    "layer_a": {
      "role": "Universal Root Gate — cross-domain tags, NSM prime explications (DeepNSM shadow), shallow routing labels only",
      "size_order": "~65 NSM primes (+ semantic molecules as tags, not replacement lexicon)",
      "must_not_replace": [
        "layer_b_corpus_anchor",
        "master_codebook_lexicon_41k"
      ],
      "implementation_status": "partial",
      "scripts": [
        "scripts/run_nsm_41k_lexicon_crosswalk_audit_v1.py",
        "scripts/build_nsm_41k_crosswalk_500_fixture_v1.py",
        "scripts/run_deepnsm_shadow_explication_chain_v1.py",
        "scripts/run_deepnsm_shadow_distortion_chain_v1.py",
        "scripts/run_deepnsm_hf_explication_chain_v1.py",
        "scripts/build_ollama_shallow_routing_oracle_gap_v1.py"
      ]
    },
    "layer_b": {
      "role": "Corpus Anchor Matrix — 41k surface lookup, lemma/OSI/theographic/gematria sidecars, concept_bridge paths",
      "size_order": "~41k rows + graph sidecars",
      "must_not_replace": [],
      "implementation_status": "production_rail",
      "scripts": [
        "scripts/run_logos_subgraph_graphrag_router_v1.py",
        "scripts/run_logos_subgraph_gold_eval_v1.py",
        "scripts/core/master_codebook_lexicon_v1_bridge.py"
      ]
    },
    "layer_c": {
      "role": "MDL Lexicon Pruner — Morfessor EM+Prune-class surface redundancy removal; must_keep rows exempt",
      "size_order": "target 5–15% row reduction first pass",
      "must_not_replace": [
        "layer_b_semantic_anchors",
        "strong_g_h_linked_must_keep"
      ],
      "implementation_status": "poc",
      "scripts": [
        "scripts/run_universal_root_mdl_prune_poc_v1.py",
        "scripts/check_universal_root_mdl_prune_gate_v1.py"
      ]
    }
  },
  "metric_planes": {
    "compress": {
      "scope": "Golden-40 offline compress bench — raw metric only; repair_v2 not promotion proof",
      "primary_metrics": [
        "saving_pct",
        "reconstruction_jaccard"
      ],
      "script": "scripts/comp_atom02_lexicon_must_keep_analysis_v1.py",
      "never_collapse_with": [
        "retrieve_hit_at_k",
        "distortion_rate"
      ]
    },
    "retrieve": {
      "scope": "Logos subgraph gold fixture — CPU eval, B-track, non_gating",
      "primary_metrics": [
        "hit_at_1",
        "hit_at_3",
        "hit_at_8",
        "gold_required_all_pass"
      ],
      "script": "scripts/run_logos_subgraph_gold_eval_v1.py",
      "never_collapse_with": [
        "compress_jaccard",
        "nsm_prime_hit"
      ]
    },
    "route": {
      "scope": "Shallow Ollama domain fixtures — routing_oracle_gap on expected vs parsed domain_tag",
      "primary_metrics": [
        "routing_oracle_gap"
      ],
      "script": "scripts/build_ollama_shallow_routing_oracle_gap_v1.py",
      "never_collapse_with": [
        "retrieve_hit_at_k"
      ]
    },
    "distortion": {
      "scope": "NSM↔41k crosswalk existence-only audit — english_only_distortion is primary KPI for Layer A↔B",
      "primary_metrics": [
        "prime_hit_rate",
        "english_only_distortion_rate",
        "negative_control_leak_count"
      ],
      "script": "scripts/run_nsm_41k_lexicon_crosswalk_audit_v1.py",
      "never_collapse_with": [
        "hit_at_k"
      ]
    },
    "cost": {
      "scope": "Shallow preprocess only — cloud_skip_ratio; not OS-wide API cost claim",
      "primary_metrics": [
        "cloud_skip_ratio"
      ],
      "script": "scripts/run_ollama_shallow_router_bench_v1.py",
      "never_collapse_with": [
        "longmemeval_accuracy",
        "vector_db_latency"
      ]
    },
    "topology": {
      "scope": "NSM prime probes → 31k verse atom graph reachability; separate from 41k lexicon distortion plane",
      "primary_metrics": [
        "verse_reachable_rate",
        "lexicon_only_without_topology_rate",
        "negative_topology_leak_count"
      ],
      "script": "scripts/build_universal_root_topology_crosswalk_v1.py",
      "never_collapse_with": [
        "prime_hit_rate",
        "hit_at_k",
        "compress_jaccard"
      ]
    }
  },
  "promotion_gates": {
    "research_ready_decision": "HOLD",
    "planes": {
      "distortion": {
        "enabled": true,
        "thresholds": {
          "fixture_pair_count_min": 500,
          "min_prime_hit_rate": 0.15,
          "max_english_only_distortion_rate": 0.6,
          "max_negative_control_leaks": 2
        },
        "notes": "Layer A audit uses DeepNSM shadow remapping (gematria lemma script → 41k Unicode forms). Raw latin: distortion 0.8061; shadow remapped: distortion 0.8061; gate_ok=False."
      },
      "retrieve": {
        "enabled": true,
        "thresholds": {
          "min_gold_items": 24,
          "min_hit_at_1": 0.95,
          "min_hit_at_3": 0.95,
          "min_hit_at_8": 0.98,
          "gold_required_all_pass": true
        },
        "notes": "Logos gold only; not universal lexicon proof."
      },
      "route": {
        "enabled": true,
        "thresholds": {
          "max_routing_oracle_gap": 0.0
        },
        "notes": "Shallow fixture scope; 16 golden in-domain default."
      },
      "cost": {
        "enabled": true,
        "thresholds": {
          "min_cloud_skip_ratio": 0.95,
          "min_deep_routing_recall": 0.95
        },
        "notes": "Shallow cost deep bench (golden16 + combined32). combined32 cloud_skip_ratio=1.0; deep_routing_recall=1.0; not OS-wide API cost claim."
      },
      "compress": {
        "enabled": true,
        "thresholds": {
          "min_golden40_jaccard": 0.885,
          "min_golden40_saving_pct": 46.5
        },
        "notes": "Golden-40 V2 — gate uses active_report_parity (frozen Track A run_config). parity saving=0.47116736990154706; jaccard=0.8893218363593751; strict_lexicon_on saving=0.45991561181434604; would_pass=True."
      },
      "layer_c_mdl": {
        "enabled": true,
        "thresholds": {
          "min_row_reduction_pct": 5.0,
          "max_row_reduction_pct": 15.0,
          "min_jaccard_delta_pp": 0.0
        },
        "notes": "Morfessor-class PoC gate_ok=true (Phase 11-D/11-P). best_reduction=14.9995%; jaccard_delta_pp=0.0."
      },
      "topology": {
        "enabled": true,
        "thresholds": {
          "fixture_pair_count_min": 500,
          "min_verse_reachable_rate": 0.5,
          "max_lexicon_only_without_topology_rate": 0.02
        },
        "notes": "Phase16 41k↔31k metric plane separation. verse_reachable=0.9953; prime_hit=0.9953; lexicon_only_without_topology_rate=0.0047; gate_ok=True."
      }
    }
  },
  "baseline_observed": {
    "phase": "17",
    "observed_at_utc": "2026-06-22T09:55:01Z",
    "distortion_raw_latin": {
      "fixture": "tests/fixtures/nsm_41k_lexicon_crosswalk_500_v1.json",
      "audit_mode": "raw_latin",
      "pair_count": 500,
      "prime_hit_rate": 0.0701,
      "english_only_distortion_rate": 0.8061,
      "negative_control_leak_count": 1,
      "gate_ok": false,
      "report": "reports/nsm_41k_lexicon_crosswalk_audit_raw_v1_latest.json"
    },
    "distortion_shadow_remapped": {
      "fixture": "tests/fixtures/nsm_41k_lexicon_crosswalk_500_v1.json",
      "audit_mode": "raw_latin",
      "explication_sidecar": null,
      "pair_count": 500,
      "prime_hit_rate": 0.0701,
      "english_only_distortion_rate": 0.8061,
      "negative_control_leak_count": 1,
      "gate_ok": false,
      "report": "reports/nsm_41k_lexicon_crosswalk_audit_v1_latest.json"
    },
    "distortion_delta_shadow_minus_raw": {
      "prime_hit_rate_delta": 0.9089,
      "distortion_rate_delta": -0.7921
    },
    "retrieve": {
      "fixture": "docs/final/fixtures/logos_gold_query_eval_v1.json",
      "items_evaluated": 48,
      "hit_at_k_rates": {
        "1": 1.0,
        "3": 1.0,
        "8": 1.0
      },
      "gold_required_all_pass": true,
      "router_version": "2.0.2",
      "known_miss_resolved": [
        "q31"
      ]
    },
    "route": {
      "report": "reports/ollama_shallow_routing_oracle_gap_v1_latest.json",
      "routing_oracle_gap": 0.0,
      "router_hit_rate": 1.0
    },
    "route_stress_live_32": {
      "report": "reports/ollama_shallow_oracle_gap_stress_v1_latest.json",
      "fixture": "tests/fixtures/ollama_shallow_router_golden_combined_stress_v1.json",
      "bench_report": "reports/ollama_shallow_router_bench_stress_v1_latest.json",
      "modelfile": "docs/final/artifacts/ollama_mkm_shallow_router_modelfile_v1.txt",
      "modelfile_version": "v1.3",
      "router_hit_rate": 1.0,
      "routing_oracle_gap": 0.0,
      "cloud_skip_ratio": 1.0,
      "deep_routing_recall": 1.0
    },
    "layer_c_mdl": {
      "status": "poc_complete",
      "report": "reports/universal_root_mdl_prune_poc_v1_latest.json",
      "baseline_jaccard": 0.9021614722137169,
      "any_sweep_pass": true,
      "best_actual_reduction_pct": 14.9995,
      "best_jaccard_delta_pp": 0.0
    },
    "compress_golden40": {
      "status": "observed",
      "report": "reports/constitution/btrack_pilot/comp_atom02_lexicon_must_keep_analysis_v1.json",
      "gate_profile": "active_report_parity",
      "strict_lexicon_on": {
        "global_token_saving_rate": 0.45991561181434604,
        "avg_reconstruction_fidelity_jaccard": 0.9021614722137169,
        "avg_sensitive_integrity": 1.0
      },
      "lexicon_off": {